{
  "definition_root": "docs/specs/2026-10-12-rust-rule-engine/examples",
  "definitions": {
    "kind": "router",
    "path": "agent-handoff.router.json",
    "binding_groups": [
      {
        "bindings": {
          "message": {
            "kind": "payload",
            "value": {
              "role": "reviewer",
              "executionForm": "sidekick",
              "outcome": "Findings on the Program Design, each with evidence, route and the smallest correction; or an explicit no-findings result.",
              "sources": [
                { "kind": "pointer", "location": "docs/specs/2026-10-12-rust-rule-engine/specification.md", "relevance": "The fixed observable contract." },
                { "kind": "pointer", "location": "docs/specs/2026-10-12-rust-rule-engine/program-design.md", "relevance": "The artifact under review." }
              ],
              "requiredReads": { "charter": "role-reviewer", "practices": [], "principles": [] },
              "limits": { "access": "inspect" },
              "stopCondition": "Stop after reporting findings; return early if a source is unreadable.",
              "returnContract": { "kind": "owned-result", "owner": "spec-program-review" },
              "reviewTarget": "program-design.md at the pinned commit",
              "procedure": "spec-program-review in program-only mode",
              "authorHistory": "none"
            }
          },
          "session": {
            "kind": "conversation",
            "transcript_path": "/home/agent/.codex/sessions/2026/10/15/rollout-reviewer.jsonl",
            "format": "codex_rollout_jsonl",
            "final_assistant_text": "Review complete. Three findings follow, each with evidence and route."
          }
        }
      }
    ]
  },
  "repositories": [],
  "payload_schemas": [{ "name": "agent-job-packet", "path": "published-schemas/agent-job-packet.schema.json" }],
  "origin": {
    "kind": "hook",
    "host": "codex",
    "event": "Stop",
    "session": "019a0000-0000-7000-8000-000000000001",
    "turn": "019a0000-0000-7000-8000-000000000042",
    "agent": { "kind": "subagent", "id": "019a0000-0000-7000-8000-000000000007", "type": "reviewer" },
    "observed_at": "2026-10-15T21:04:05Z"
  },
  "cursors": [],
  "execution": { "speculation": "off", "max_concurrent_requests": 4 },
  "limits": {
    "max_files": 4,
    "max_file_bytes": 262144,
    "max_total_bytes": 1048576,
    "max_matches": 64,
    "max_transcript_bytes": 8388608,
    "include_ignored": false
  },
  "backend": { "kind": "jev_openrouter", "endpoint": "https://openrouter.ai/api/v1/systemone", "model": "jev-latest" },
  "attempts": {
    "attempt_timeout_ms": 10000,
    "retry_count": 0,
    "initial_backoff_ms": 500,
    "max_backoff_ms": 4000,
    "max_response_bytes": 1048576
  },
  "request_budget": {
    "max_input_tokens": 64000,
    "max_request_bytes": 524288,
    "max_questions": 32,
    "max_requests": 6,
    "safety_margin_tokens": 4000,
    "accounting_policy": "allow_estimated"
  }
}
